00:28:20.606524 IP 5aaacd282fc3.44298 > 192.168.99.100.3001: tcp 349
00:28:20.607525 IP 192.168.99.100.3001 > 5aaacd282fc3.44298: tcp 623
00:28:20.616567 IP 5aaacd282fc3.44294 > 192.168.99.100.3001: tcp 349
00:28:20.616615 IP 5aaacd282fc3.44292 > 192.168.99.100.3001: tcp 349
00:28:20.616618 IP 5aaacd282fc3.44302 > 192.168.99.100.3001: tcp 349
00:28:20.616619 IP 5aaacd282fc3.44300 > 192.168.99.100.3001: tcp 349
00:28:20.616621 IP 5aaacd282fc3.44296 > 192.168.99.100.3001: tcp 349
00:28:20.629095 IP 5aaacd282fc3.44296 > 192.168.99.100.3001: tcp 0
00:28:20.629102 IP 5aaacd282fc3.44300 > 192.168.99.100.3001: tcp 0
00:28:20.629104 IP 5aaacd282fc3.44302 > 192.168.99.100.3001: tcp 0
00:28:20.629105 IP 5aaacd282fc3.44292 > 192.168.99.100.3001: tcp 0
00:28:20.632413 IP 5aaacd282fc3.44294 > 192.168.99.100.3001: tcp 0
00:28:20.634831 IP 5aaacd282fc3.44296 > 192.168.99.100.3001: tcp 349
00:28:20.634845 IP 5aaacd282fc3.44300 > 192.168.99.100.3001: tcp 349
00:28:20.634847 IP 5aaacd282fc3.44302 > 192.168.99.100.3001: tcp 350
00:28:20.634848 IP 5aaacd282fc3.44292 > 192.168.99.100.3001: tcp 350
00:28:20.634850 IP 5aaacd282fc3.44294 > 192.168.99.100.3001: tcp 350
00:28:20.634851 IP 5aaacd282fc3.44298 > 192.168.99.100.3001: tcp 350
00:28:20.637120 IP 192.168.99.100.3001 > 5aaacd282fc3.44298: tcp 627
00:28:20.666514 IP 5aaacd282fc3.44298 > 192.168.99.100.3001: tcp 350
00:28:20.666524 IP 5aaacd282fc3.44294 > 192.168.99.100.3001: tcp 350
00:28:20.666525 IP 5aaacd282fc3.44292 > 192.168.99.100.3001: tcp 350
00:28:20.666526 IP 5aaacd282fc3.44302 > 192.168.99.100.3001: tcp 350
00:28:20.666527 IP 5aaacd282fc3.44300 > 192.168.99.100.3001: tcp 350
00:28:20.666528 IP 5aaacd282fc3.44296 > 192.168.99.100.3001: tcp 350
00:28:20.668696 IP 192.168.99.100.3001 > 5aaacd282fc3.44296: tcp 615
00:28:20.697776 IP 5aaacd282fc3.44296 > 192.168.99.100.3001: tcp 350
00:28:20.697788 IP 5aaacd282fc3.44300 > 192.168.99.100.3001: tcp 350
00:28:20.697789 IP 5aaacd282fc3.44302 > 192.168.99.100.3001: tcp 350
00:28:20.697791 IP 5aaacd282fc3.44292 > 192.168.99.100.3001: tcp 350
00:28:20.697792 IP 5aaacd282fc3.44294 > 192.168.99.100.3001: tcp 350
00:28:20.697793 IP 5aaacd282fc3.44298 > 192.168.99.100.3001: tcp 350
00:28:20.701242 IP 192.168.99.100.3001 > 5aaacd282fc3.44298: tcp 623
00:28:20.724913 IP 5aaacd282fc3.44298 > 192.168.99.100.3001: tcp 350
00:28:20.724926 IP 5aaacd282fc3.44294 > 192.168.99.100.3001: tcp 350
00:28:20.724928 IP 5aaacd282fc3.44292 > 192.168.99.100.3001: tcp 350
00:28:20.724929 IP 5aaacd282fc3.44302 > 192.168.99.100.3001: tcp 350
00:28:20.724931 IP 5aaacd282fc3.44300 > 192.168.99.100.3001: tcp 350
00:28:20.726963 IP 192.168.99.100.3001 > 5aaacd282fc3.44300: tcp 610
00:28:20.727203 IP 192.168.99.100.3001 > 5aaacd282fc3.44302: tcp 618
00:28:20.738564 IP 5aaacd282fc3.44296 > 192.168.99.100.3001: tcp 350
00:28:20.740330 IP 192.168.99.100.3001 > 5aaacd282fc3.44296: tcp 630
00:28:20.754234 IP 5aaacd282fc3.44300 > 192.168.99.100.3001: tcp 350
00:28:20.754244 IP 5aaacd282fc3.44302 > 192.168.99.100.3001: tcp 350
00:28:20.754247 IP 5aaacd282fc3.44292 > 192.168.99.100.3001: tcp 350
00:28:20.754756 IP 5aaacd282fc3.44294 > 192.168.99.100.3001: tcp 350
00:28:20.754793 IP 5aaacd282fc3.44298 > 192.168.99.100.3001: tcp 350
00:28:20.754796 IP 5aaacd282fc3.44296 > 192.168.99.100.3001: tcp 350
00:28:20.758415 IP 192.168.99.100.3001 > 5aaacd282fc3.44292: tcp 621
00:28:20.758818 IP 192.168.99.100.3001 > 5aaacd282fc3.44302: tcp 654
00:28:20.759465 IP 192.168.99.100.3001 > 5aaacd282fc3.44300: tcp 609
00:28:20.761060 IP 192.168.99.100.3001 > 5aaacd282fc3.44296: tcp 617
00:28:20.761361 IP 192.168.99.100.3001 > 5aaacd282fc3.44298: tcp 621
00:28:20.761769 IP 192.168.99.100.3001 > 5aaacd282fc3.44294: tcp 660
00:28:20.780741 IP 5aaacd282fc3.44292 > 192.168.99.100.3001: tcp 350
00:28:20.780753 IP 5aaacd282fc3.44302 > 192.168.99.100.3001: tcp 350
00:28:20.780754 IP 5aaacd282fc3.44300 > 192.168.99.100.3001: tcp 350
00:28:20.780756 IP 5aaacd282fc3.44296 > 192.168.99.100.3001: tcp 350
00:28:20.780757 IP 5aaacd282fc3.44298 > 192.168.99.100.3001: tcp 350
00:28:20.780758 IP 5aaacd282fc3.44294 > 192.168.99.100.3001: tcp 350
00:28:20.784296 IP 192.168.99.100.3001 > 5aaacd282fc3.44294: tcp 627
00:28:20.809192 IP 5aaacd282fc3.44294 > 192.168.99.100.3001: tcp 350
00:28:20.809201 IP 5aaacd282fc3.44298 > 192.168.99.100.3001: tcp 350
00:28:20.809202 IP 5aaacd282fc3.44296 > 192.168.99.100.3001: tcp 350
00:28:20.809203 IP 5aaacd282fc3.44300 > 192.168.99.100.3001: tcp 350
00:28:20.809204 IP 5aaacd282fc3.44302 > 192.168.99.100.3001: tcp 350
00:28:20.809205 IP 5aaacd282fc3.44292 > 192.168.99.100.3001: tcp 350
00:28:20.811352 IP 192.168.99.100.3001 > 5aaacd282fc3.44292: tcp 634
00:28:20.834349 IP 5aaacd282fc3.44292 > 192.168.99.100.3001: tcp 350
00:28:20.834850 IP 5aaacd282fc3.44302 > 192.168.99.100.3001: tcp 350
00:28:20.834853 IP 5aaacd282fc3.44300 > 192.168.99.100.3001: tcp 350
00:28:20.834855 IP 5aaacd282fc3.44296 > 192.168.99.100.3001: tcp 350
00:28:20.834856 IP 5aaacd282fc3.44298 > 192.168.99.100.3001: tcp 350
00:28:20.834857 IP 5aaacd282fc3.44294 > 192.168.99.100.3001: tcp 350
00:28:20.838997 IP 192.168.99.100.3001 > 5aaacd282fc3.44294: tcp 629
00:28:20.853795 IP 5aaacd282fc3.44294 > 192.168.99.100.3001: tcp 350
00:28:20.853804 IP 5aaacd282fc3.44298 > 192.168.99.100.3001: tcp 350
00:28:20.853806 IP 5aaacd282fc3.44296 > 192.168.99.100.3001: tcp 350
00:28:20.853807 IP 5aaacd282fc3.44300 > 192.168.99.100.3001: tcp 350
00:28:20.853808 IP 5aaacd282fc3.44302 > 192.168.99.100.3001: tcp 350
00:28:20.855380 IP 192.168.99.100.3001 > 5aaacd282fc3.44302: tcp 613
00:28:20.855620 IP 192.168.99.100.3001 > 5aaacd282fc3.44300: tcp 832
00:28:20.889099 IP 5aaacd282fc3.44292 > 192.168.99.100.3001: tcp 0
00:28:20.904482 IP 5aaacd282fc3.44294 > 192.168.99.100.3001: tcp 0
00:28:20.904491 IP 5aaacd282fc3.44298 > 192.168.99.100.3001: tcp 0
00:28:20.904493 IP 5aaacd282fc3.44296 > 192.168.99.100.3001: tcp 0
00:28:20.906116 IP 5aaacd282fc3.44300 > 192.168.99.100.3001: tcp 0
00:28:20.907924 IP 5aaacd282fc3.44302 > 192.168.99.100.3001: tcp 0