00:30:48.708649 IP 5aaacd282fc3.38732 > 192.168.99.100.3002: tcp 65
00:30:48.708657 IP 5aaacd282fc3.38732 > 192.168.99.100.3002: tcp 46
00:30:48.708727 IP 192.168.99.100.3002 > 5aaacd282fc3.38732: tcp 0
00:30:48.709973 IP 192.168.99.100.3002 > 5aaacd282fc3.38732: tcp 38
00:30:48.710072 IP 192.168.99.100.3002 > 5aaacd282fc3.38732: tcp 37
00:30:48.710495 IP 192.168.99.100.3002 > 5aaacd282fc3.38732: tcp 38
00:30:48.710716 IP 192.168.99.100.3002 > 5aaacd282fc3.38732: tcp 526
00:30:48.733797 IP 5aaacd282fc3.38732 > 192.168.99.100.3002: tcp 0
00:30:48.749147 IP 5aaacd282fc3.38732 > 192.168.99.100.3002: tcp 66
00:30:48.750155 IP 5aaacd282fc3.38732 > 192.168.99.100.3002: tcp 66
00:30:48.750176 IP 5aaacd282fc3.38732 > 192.168.99.100.3002: tcp 66
00:30:48.750178 IP 5aaacd282fc3.38732 > 192.168.99.100.3002: tcp 66
00:30:48.750180 IP 5aaacd282fc3.38732 > 192.168.99.100.3002: tcp 66
00:30:48.750181 IP 5aaacd282fc3.38732 > 192.168.99.100.3002: tcp 66
00:30:48.750182 IP 5aaacd282fc3.38732 > 192.168.99.100.3002: tcp 66
00:30:48.758420 IP 192.168.99.100.3002 > 5aaacd282fc3.38732: tcp 38
00:30:48.760300 IP 5aaacd282fc3.38732 > 192.168.99.100.3002: tcp 66
00:30:48.760303 IP 5aaacd282fc3.38732 > 192.168.99.100.3002: tcp 66
00:30:48.760304 IP 5aaacd282fc3.38732 > 192.168.99.100.3002: tcp 66
00:30:48.760306 IP 5aaacd282fc3.38732 > 192.168.99.100.3002: tcp 66
00:30:48.760307 IP 5aaacd282fc3.38732 > 192.168.99.100.3002: tcp 66
00:30:48.760479 IP 192.168.99.100.3002 > 5aaacd282fc3.38732: tcp 0
00:30:48.766202 IP 5aaacd282fc3.38732 > 192.168.99.100.3002: tcp 66
00:30:48.766666 IP 5aaacd282fc3.38732 > 192.168.99.100.3002: tcp 66
00:30:48.766682 IP 5aaacd282fc3.38732 > 192.168.99.100.3002: tcp 66
00:30:48.766683 IP 5aaacd282fc3.38732 > 192.168.99.100.3002: tcp 66
00:30:48.766685 IP 5aaacd282fc3.38732 > 192.168.99.100.3002: tcp 66
00:30:48.766737 IP 192.168.99.100.3002 > 5aaacd282fc3.38732: tcp 0
00:30:48.767709 IP 192.168.99.100.3002 > 5aaacd282fc3.38732: tcp 2896
00:30:48.770651 IP 5aaacd282fc3.38732 > 192.168.99.100.3002: tcp 66
00:30:48.770669 IP 5aaacd282fc3.38732 > 192.168.99.100.3002: tcp 66
00:30:48.770781 IP 192.168.99.100.3002 > 5aaacd282fc3.38732: tcp 0
00:30:48.778288 IP 5aaacd282fc3.38732 > 192.168.99.100.3002: tcp 0
00:30:48.778293 IP 5aaacd282fc3.38732 > 192.168.99.100.3002: tcp 0
00:30:48.789236 IP 192.168.99.100.3002 > 5aaacd282fc3.38732: tcp 38
00:30:48.806794 IP 192.168.99.100.3002 > 5aaacd282fc3.38732: tcp 2896
00:30:48.806809 IP 192.168.99.100.3002 > 5aaacd282fc3.38732: tcp 2896
00:30:48.806813 IP 192.168.99.100.3002 > 5aaacd282fc3.38732: tcp 1139
00:30:48.816907 IP 5aaacd282fc3.38732 > 192.168.99.100.3002: tcp 0
00:30:48.816926 IP 5aaacd282fc3.38732 > 192.168.99.100.3002: tcp 0
00:30:48.850270 IP 5aaacd282fc3.38732 > 192.168.99.100.3002: tcp 66
00:30:48.850280 IP 5aaacd282fc3.38732 > 192.168.99.100.3002: tcp 66
00:30:48.850567 IP 192.168.99.100.3002 > 5aaacd282fc3.38732: tcp 0
00:30:48.851322 IP 5aaacd282fc3.38732 > 192.168.99.100.3002: tcp 66
00:30:48.851338 IP 5aaacd282fc3.38732 > 192.168.99.100.3002: tcp 66
00:30:48.851339 IP 5aaacd282fc3.38732 > 192.168.99.100.3002: tcp 66
00:30:48.851340 IP 5aaacd282fc3.38732 > 192.168.99.100.3002: tcp 66
00:30:48.892660 IP 192.168.99.100.3002 > 5aaacd282fc3.38732: tcp 38
00:30:48.928848 IP 192.168.99.100.3002 > 5aaacd282fc3.38732: tcp 2896
00:30:48.928863 IP 192.168.99.100.3002 > 5aaacd282fc3.38732: tcp 2896
00:30:48.928868 IP 192.168.99.100.3002 > 5aaacd282fc3.38732: tcp 2896
00:30:48.928873 IP 192.168.99.100.3002 > 5aaacd282fc3.38732: tcp 2896
00:30:48.928877 IP 192.168.99.100.3002 > 5aaacd282fc3.38732: tcp 2896
00:30:48.928881 IP 192.168.99.100.3002 > 5aaacd282fc3.38732: tcp 2142
00:30:48.933133 IP 5aaacd282fc3.38732 > 192.168.99.100.3002: tcp 0
00:30:48.939176 IP 5aaacd282fc3.38732 > 192.168.99.100.3002: tcp 0
00:30:48.939181 IP 5aaacd282fc3.38732 > 192.168.99.100.3002: tcp 0
00:30:48.939182 IP 5aaacd282fc3.38732 > 192.168.99.100.3002: tcp 0
00:30:48.939183 IP 5aaacd282fc3.38732 > 192.168.99.100.3002: tcp 0
00:30:48.939184 IP 5aaacd282fc3.38732 > 192.168.99.100.3002: tcp 0
00:30:48.939185 IP 5aaacd282fc3.38732 > 192.168.99.100.3002: tcp 0