00:47:41.694883 IP 5aaacd282fc3.44468 > 192.168.99.100.3001: tcp 0
00:47:41.694945 IP 192.168.99.100.3001 > 5aaacd282fc3.44468: tcp 0
00:47:41.705260 IP 5aaacd282fc3.44468 > 192.168.99.100.3001: tcp 0
00:47:41.706206 IP 5aaacd282fc3.44468 > 192.168.99.100.3001: tcp 148
00:47:41.706356 IP 192.168.99.100.3001 > 5aaacd282fc3.44468: tcp 0
00:47:41.707415 IP 192.168.99.100.3001 > 5aaacd282fc3.44468: tcp 829
00:47:41.717460 IP 5aaacd282fc3.44468 > 192.168.99.100.3001: tcp 0
00:47:41.718345 IP 5aaacd282fc3.44468 > 192.168.99.100.3001: tcp 126
00:47:41.719414 IP 192.168.99.100.3001 > 5aaacd282fc3.44468: tcp 258
00:47:41.730062 IP 5aaacd282fc3.44468 > 192.168.99.100.3001: tcp 527
00:47:41.731064 IP 192.168.99.100.3001 > 5aaacd282fc3.44468: tcp 204
00:47:41.776277 IP 5aaacd282fc3.44468 > 192.168.99.100.3001: tcp 0
00:47:41.821918 IP 5aaacd282fc3.44468 > 192.168.99.100.3001: tcp 106
00:47:41.821923 IP 5aaacd282fc3.44468 > 192.168.99.100.3001: tcp 50
00:47:41.821924 IP 5aaacd282fc3.44468 > 192.168.99.100.3001: tcp 50
00:47:41.821925 IP 5aaacd282fc3.44468 > 192.168.99.100.3001: tcp 46
00:47:41.821926 IP 5aaacd282fc3.44468 > 192.168.99.100.3001: tcp 49
00:47:41.821927 IP 5aaacd282fc3.44468 > 192.168.99.100.3001: tcp 49
00:47:41.821928 IP 5aaacd282fc3.44468 > 192.168.99.100.3001: tcp 46
00:47:41.832405 IP 5aaacd282fc3.44468 > 192.168.99.100.3001: tcp 2389
00:47:41.832462 IP 192.168.99.100.3001 > 5aaacd282fc3.44468: tcp 0
00:47:41.833104 IP 5aaacd282fc3.44468 > 192.168.99.100.3001: tcp 0
00:47:41.834810 IP 5aaacd282fc3.44468 > 192.168.99.100.3001: tcp 0
00:47:41.837395 IP 192.168.99.100.3001 > 5aaacd282fc3.44468: tcp 307
00:47:41.837740 IP 192.168.99.100.3001 > 5aaacd282fc3.44468: tcp 321
00:47:41.839474 IP 192.168.99.100.3001 > 5aaacd282fc3.44468: tcp 311
00:47:41.839833 IP 192.168.99.100.3001 > 5aaacd282fc3.44468: tcp 359
00:47:41.841404 IP 192.168.99.100.3001 > 5aaacd282fc3.44468: tcp 331
00:47:41.842022 IP 192.168.99.100.3001 > 5aaacd282fc3.44468: tcp 306
00:47:41.842475 IP 192.168.99.100.3001 > 5aaacd282fc3.44468: tcp 322
00:47:41.842791 IP 192.168.99.100.3001 > 5aaacd282fc3.44468: tcp 333
00:47:41.844538 IP 192.168.99.100.3001 > 5aaacd282fc3.44468: tcp 310
00:47:41.845200 IP 192.168.99.100.3001 > 5aaacd282fc3.44468: tcp 325
00:47:41.848100 IP 5aaacd282fc3.44468 > 192.168.99.100.3001: tcp 0
00:47:41.848120 IP 5aaacd282fc3.44468 > 192.168.99.100.3001: tcp 0
00:47:41.848220 IP 192.168.99.100.3001 > 5aaacd282fc3.44468: tcp 620
00:47:41.848477 IP 192.168.99.100.3001 > 5aaacd282fc3.44468: tcp 308
00:47:41.851497 IP 5aaacd282fc3.44468 > 192.168.99.100.3001: tcp 0
00:47:41.851504 IP 5aaacd282fc3.44468 > 192.168.99.100.3001: tcp 0
00:47:41.851505 IP 5aaacd282fc3.44468 > 192.168.99.100.3001: tcp 0
00:47:41.852881 IP 192.168.99.100.3001 > 5aaacd282fc3.44468: tcp 333
00:47:41.853164 IP 192.168.99.100.3001 > 5aaacd282fc3.44468: tcp 310
00:47:41.853426 IP 192.168.99.100.3001 > 5aaacd282fc3.44468: tcp 291
00:47:41.853700 IP 192.168.99.100.3001 > 5aaacd282fc3.44468: tcp 300
00:47:41.855387 IP 192.168.99.100.3001 > 5aaacd282fc3.44468: tcp 310
00:47:41.855662 IP 192.168.99.100.3001 > 5aaacd282fc3.44468: tcp 318
00:47:41.855954 IP 5aaacd282fc3.44468 > 192.168.99.100.3001: tcp 0
00:47:41.855967 IP 5aaacd282fc3.44468 > 192.168.99.100.3001: tcp 0
00:47:41.855969 IP 5aaacd282fc3.44468 > 192.168.99.100.3001: tcp 0
00:47:41.855970 IP 5aaacd282fc3.44468 > 192.168.99.100.3001: tcp 0
00:47:41.855971 IP 5aaacd282fc3.44468 > 192.168.99.100.3001: tcp 0
00:47:41.858305 IP 5aaacd282fc3.44468 > 192.168.99.100.3001: tcp 0
00:47:41.858586 IP 192.168.99.100.3001 > 5aaacd282fc3.44468: tcp 306
00:47:41.858884 IP 192.168.99.100.3001 > 5aaacd282fc3.44468: tcp 293
00:47:41.859165 IP 192.168.99.100.3001 > 5aaacd282fc3.44468: tcp 313
00:47:41.859449 IP 192.168.99.100.3001 > 5aaacd282fc3.44468: tcp 301
00:47:41.859755 IP 192.168.99.100.3001 > 5aaacd282fc3.44468: tcp 304
00:47:41.861219 IP 192.168.99.100.3001 > 5aaacd282fc3.44468: tcp 294
00:47:41.861487 IP 192.168.99.100.3001 > 5aaacd282fc3.44468: tcp 310
00:47:41.861551 IP 5aaacd282fc3.44468 > 192.168.99.100.3001: tcp 0
00:47:41.862532 IP 192.168.99.100.3001 > 5aaacd282fc3.44468: tcp 300
00:47:41.862807 IP 192.168.99.100.3001 > 5aaacd282fc3.44468: tcp 324
00:47:41.863190 IP 192.168.99.100.3001 > 5aaacd282fc3.44468: tcp 308
00:47:41.864932 IP 192.168.99.100.3001 > 5aaacd282fc3.44468: tcp 321
00:47:41.865252 IP 192.168.99.100.3001 > 5aaacd282fc3.44468: tcp 274
00:47:41.865539 IP 192.168.99.100.3001 > 5aaacd282fc3.44468: tcp 303
00:47:41.866175 IP 5aaacd282fc3.44468 > 192.168.99.100.3001: tcp 0
00:47:41.866192 IP 5aaacd282fc3.44468 > 192.168.99.100.3001: tcp 0
00:47:41.866193 IP 5aaacd282fc3.44468 > 192.168.99.100.3001: tcp 0
00:47:41.866193 IP 5aaacd282fc3.44468 > 192.168.99.100.3001: tcp 0
00:47:41.866971 IP 5aaacd282fc3.44468 > 192.168.99.100.3001: tcp 0
00:47:41.868209 IP 192.168.99.100.3001 > 5aaacd282fc3.44468: tcp 288
00:47:41.868551 IP 192.168.99.100.3001 > 5aaacd282fc3.44468: tcp 319
00:47:41.868825 IP 192.168.99.100.3001 > 5aaacd282fc3.44468: tcp 291
00:47:41.869085 IP 5aaacd282fc3.44468 > 192.168.99.100.3001: tcp 0
00:47:41.869096 IP 5aaacd282fc3.44468 > 192.168.99.100.3001: tcp 0
00:47:41.869196 IP 192.168.99.100.3001 > 5aaacd282fc3.44468: tcp 312
00:47:41.871571 IP 5aaacd282fc3.44468 > 192.168.99.100.3001: tcp 0
00:47:41.871578 IP 5aaacd282fc3.44468 > 192.168.99.100.3001: tcp 0
00:47:41.871948 IP 192.168.99.100.3001 > 5aaacd282fc3.44468: tcp 269
00:47:41.872290 IP 192.168.99.100.3001 > 5aaacd282fc3.44468: tcp 285
00:47:41.872564 IP 192.168.99.100.3001 > 5aaacd282fc3.44468: tcp 303
00:47:41.872816 IP 192.168.99.100.3001 > 5aaacd282fc3.44468: tcp 278
00:47:41.875115 IP 5aaacd282fc3.44468 > 192.168.99.100.3001: tcp 0
00:47:41.875130 IP 5aaacd282fc3.44468 > 192.168.99.100.3001: tcp 0
00:47:41.875132 IP 5aaacd282fc3.44468 > 192.168.99.100.3001: tcp 0
00:47:41.875135 IP 5aaacd282fc3.44468 > 192.168.99.100.3001: tcp 0
00:47:41.875360 IP 5aaacd282fc3.44468 > 192.168.99.100.3001: tcp 0
00:47:41.875829 IP 192.168.99.100.3001 > 5aaacd282fc3.44468: tcp 289
00:47:41.876047 IP 5aaacd282fc3.44468 > 192.168.99.100.3001: tcp 0
00:47:41.878839 IP 192.168.99.100.3001 > 5aaacd282fc3.44468: tcp 318
00:47:41.880525 IP 192.168.99.100.3001 > 5aaacd282fc3.44468: tcp 265
00:47:41.880879 IP 192.168.99.100.3001 > 5aaacd282fc3.44468: tcp 333
00:47:41.881125 IP 192.168.99.100.3001 > 5aaacd282fc3.44468: tcp 263
00:47:41.881742 IP 5aaacd282fc3.44468 > 192.168.99.100.3001: tcp 0
00:47:41.881758 IP 5aaacd282fc3.44468 > 192.168.99.100.3001: tcp 0
00:47:41.881760 IP 5aaacd282fc3.44468 > 192.168.99.100.3001: tcp 0
00:47:41.881761 IP 5aaacd282fc3.44468 > 192.168.99.100.3001: tcp 0
00:47:41.881762 IP 5aaacd282fc3.44468 > 192.168.99.100.3001: tcp 0
00:47:41.881763 IP 5aaacd282fc3.44468 > 192.168.99.100.3001: tcp 0
00:47:41.882387 IP 5aaacd282fc3.44468 > 192.168.99.100.3001: tcp 0
00:47:41.884631 IP 5aaacd282fc3.44468 > 192.168.99.100.3001: tcp 0
00:47:41.884643 IP 5aaacd282fc3.44468 > 192.168.99.100.3001: tcp 0
00:47:41.886451 IP 5aaacd282fc3.44468 > 192.168.99.100.3001: tcp 0
00:47:41.886459 IP 5aaacd282fc3.44468 > 192.168.99.100.3001: tcp 0
00:47:41.887300 IP 5aaacd282fc3.44468 > 192.168.99.100.3001: tcp 0
00:47:41.887307 IP 5aaacd282fc3.44468 > 192.168.99.100.3001: tcp 0
00:47:41.887308 IP 5aaacd282fc3.44468 > 192.168.99.100.3001: tcp 0
00:47:41.891649 IP 5aaacd282fc3.44468 > 192.168.99.100.3001: tcp 0
00:47:41.891657 IP 5aaacd282fc3.44468 > 192.168.99.100.3001: tcp 0
00:47:41.891660 IP 5aaacd282fc3.44468 > 192.168.99.100.3001: tcp 0
00:47:41.891662 IP 5aaacd282fc3.44468 > 192.168.99.100.3001: tcp 0
00:47:41.891662 IP 5aaacd282fc3.44468 > 192.168.99.100.3001: tcp 0
00:47:41.891663 IP 5aaacd282fc3.44468 > 192.168.99.100.3001: tcp 0